{
  "schemaVersion": "2.0.0",
  "analysisId": "wpa-f13-selected-ai",
  "analysisVersion": "1.0.0",
  "ruleSetVersion": "wc-m2-rules/1.0.0",
  "generatedAt": "2026-08-30T00:00:00Z",
  "evaluationHorizonYears": 1,
  "definitionRef": {
    "definitionId": "wd-marketing-ad-strategy-synthetic-m1",
    "schemaVersion": "1.0.0",
    "contentDigest": "sha256-046858bf3ef170a95ce1ead0e453a96ca9b6f7844178937678a42cac437691c1"
  },
  "provenance": {
    "kind": "synthetic",
    "generatedAt": "2026-08-30T00:00:00Z",
    "sources": [
      {
        "id": "ev-prov",
        "status": "assumed",
        "sourceType": "synthetic",
        "sourceRef": null,
        "claim": "Synthetic M2 fixture",
        "observedAt": null,
        "note": null
      }
    ]
  },
  "scopeTaskIds": [
    "task-platform-fit-assessment"
  ],
  "taskAnalyses": [
    {
      "taskId": "task-platform-fit-assessment",
      "workCharacteristics": {
        "repeatability": {
          "score": 4,
          "rubricId": "rubric.repeatability/1.0.0",
          "rationale": "Synthetic",
          "evidence": {
            "id": "ev-r-609xeo",
            "status": "assumed",
            "sourceType": "synthetic",
            "sourceRef": null,
            "claim": "Synthetic M2 fixture",
            "observedAt": null,
            "note": null
          }
        },
        "digitality": {
          "score": 5,
          "rubricId": "rubric.digitality/1.0.0",
          "rationale": "Synthetic",
          "evidence": {
            "id": "ev-r-vhcq8l",
            "status": "assumed",
            "sourceType": "synthetic",
            "sourceRef": null,
            "claim": "Synthetic M2 fixture",
            "observedAt": null,
            "note": null
          }
        },
        "exceptionRate": {
          "score": 1,
          "rubricId": "rubric.exceptionRate/1.0.0",
          "rationale": "Synthetic",
          "evidence": {
            "id": "ev-r-004vl8",
            "status": "assumed",
            "sourceType": "synthetic",
            "sourceRef": null,
            "claim": "Synthetic M2 fixture",
            "observedAt": null,
            "note": null
          }
        },
        "judgmentEmpathy": {
          "score": 1,
          "rubricId": "rubric.judgmentEmpathy/1.0.0",
          "rationale": "Synthetic",
          "evidence": {
            "id": "ev-r-6eg3fu",
            "status": "assumed",
            "sourceType": "synthetic",
            "sourceRef": null,
            "claim": "Synthetic M2 fixture",
            "observedAt": null,
            "note": null
          }
        },
        "specifiability": {
          "score": 4,
          "rubricId": "rubric.specifiability/1.0.0",
          "rationale": "Synthetic",
          "evidence": {
            "id": "ev-r-bb1qai",
            "status": "assumed",
            "sourceType": "synthetic",
            "sourceRef": null,
            "claim": "Synthetic M2 fixture",
            "observedAt": null,
            "note": null
          }
        },
        "procedureSteps": [
          "Gather inputs",
          "Analyze",
          "Write memo"
        ],
        "knownExceptions": []
      },
      "operatingConstraints": {
        "deadline": null,
        "requiredAvailability": "business_hours",
        "dataSensitivity": "internal",
        "requiredAuthority": "draft",
        "mustInternal": false,
        "forbiddenExecutionTypes": [],
        "legalConstraints": [],
        "contractConstraints": [],
        "securityConstraints": [],
        "evidence": [
          {
            "id": "ev-oc",
            "status": "assumed",
            "sourceType": "synthetic",
            "sourceRef": null,
            "claim": "Synthetic M2 fixture",
            "observedAt": null,
            "note": null
          }
        ]
      },
      "demand": {
        "frequency": {
          "value": 2,
          "unit": "assessments",
          "period": "week",
          "evidence": {
            "id": "ev-t1447o",
            "status": "assumed",
            "sourceType": "synthetic",
            "sourceRef": null,
            "claim": "Synthetic M2 fixture",
            "observedAt": null,
            "note": null
          }
        },
        "volume": {
          "value": 1,
          "unit": "platforms",
          "period": "event",
          "evidence": {
            "id": "ev-ske43g",
            "status": "assumed",
            "sourceType": "synthetic",
            "sourceRef": null,
            "claim": "Synthetic M2 fixture",
            "observedAt": null,
            "note": null
          }
        },
        "variabilityPct": {
          "value": 10,
          "unit": "percent",
          "period": null,
          "evidence": {
            "id": "ev-7dkctm",
            "status": "assumed",
            "sourceType": "synthetic",
            "sourceRef": null,
            "claim": "Synthetic M2 fixture",
            "observedAt": null,
            "note": null
          }
        },
        "peakVolume": {
          "value": 3,
          "unit": "platforms",
          "period": "week",
          "evidence": {
            "id": "ev-gysipv",
            "status": "assumed",
            "sourceType": "synthetic",
            "sourceRef": null,
            "claim": "Synthetic M2 fixture",
            "observedAt": null,
            "note": null
          }
        },
        "slaTurnaround": {
          "value": 120,
          "unit": "minute",
          "period": "event",
          "evidence": {
            "id": "ev-mhma0a",
            "status": "assumed",
            "sourceType": "synthetic",
            "sourceRef": null,
            "claim": "Synthetic M2 fixture",
            "observedAt": null,
            "note": null
          }
        }
      },
      "currentState": {
        "ownerRoleId": "role-ad-strategy-operator",
        "capacity": {
          "value": 2400,
          "unit": "minute",
          "period": "month",
          "evidence": {
            "id": "ev-vrl80t",
            "status": "assumed",
            "sourceType": "synthetic",
            "sourceRef": null,
            "claim": "Synthetic M2 fixture",
            "observedAt": null,
            "note": null
          }
        },
        "skillProfile": [
          {
            "skillId": "skill-unit-economics-analysis",
            "attainedLevel": 3,
            "evidence": {
              "id": "ev-s-u176jy",
              "status": "assumed",
              "sourceType": "synthetic",
              "sourceRef": null,
              "claim": "Synthetic M2 fixture",
              "observedAt": null,
              "note": null
            }
          },
          {
            "skillId": "skill-experiment-design",
            "attainedLevel": 2,
            "evidence": {
              "id": "ev-s-ja1a1f",
              "status": "assumed",
              "sourceType": "synthetic",
              "sourceRef": null,
              "claim": "Synthetic M2 fixture",
              "observedAt": null,
              "note": null
            }
          }
        ],
        "timeSpent": {
          "value": 180,
          "unit": "minute",
          "period": "week",
          "evidence": {
            "id": "ev-om9ev3",
            "status": "assumed",
            "sourceType": "synthetic",
            "sourceRef": null,
            "claim": "Synthetic M2 fixture",
            "observedAt": null,
            "note": null
          }
        },
        "costPerPeriod": {
          "amount": 500000,
          "currency": "JPY",
          "period": "month",
          "evidence": {
            "id": "ev-m-m20f6b",
            "status": "assumed",
            "sourceType": "synthetic",
            "sourceRef": null,
            "claim": "Synthetic M2 fixture",
            "observedAt": null,
            "note": null
          }
        },
        "qualityRecord": {
          "score": 3,
          "rubricId": "rubric.qualityRecord/1.0.0",
          "rationale": "Synthetic",
          "evidence": {
            "id": "ev-r-y5p18c",
            "status": "assumed",
            "sourceType": "synthetic",
            "sourceRef": null,
            "claim": "Synthetic M2 fixture",
            "observedAt": null,
            "note": null
          }
        },
        "evidence": [
          {
            "id": "ev-cs",
            "status": "assumed",
            "sourceType": "synthetic",
            "sourceRef": null,
            "claim": "Synthetic M2 fixture",
            "observedAt": null,
            "note": null
          }
        ]
      },
      "optionEstimates": [
        {
          "candidate": "ai",
          "setupTime": {
            "value": 480,
            "unit": "minute",
            "period": "year",
            "evidence": {
              "id": "ev-tg9z9l",
              "status": "assumed",
              "sourceType": "synthetic",
              "sourceRef": null,
              "claim": "Synthetic M2 fixture",
              "observedAt": null,
              "note": null
            }
          },
          "setupCost": {
            "low": {
              "amount": 100000,
              "currency": "JPY",
              "period": "year",
              "evidence": {
                "id": "ev-m-u9ospk",
                "status": "assumed",
                "sourceType": "synthetic",
                "sourceRef": null,
                "claim": "Synthetic M2 fixture",
                "observedAt": null,
                "note": null
              }
            },
            "base": {
              "amount": 200000,
              "currency": "JPY",
              "period": "year",
              "evidence": {
                "id": "ev-m-m1vrre",
                "status": "assumed",
                "sourceType": "synthetic",
                "sourceRef": null,
                "claim": "Synthetic M2 fixture",
                "observedAt": null,
                "note": null
              }